{
  "apiVersion": "omca.dev/v1alpha1",
  "kind": "Report",
  "metadata": {
    "id": "report:worktree:sha256:abc",
    "worktree": "worktree:sha256:abc",
    "generatedAt": "2026-07-16T00:00:00Z"
  },
  "spec": {
    "fingerprint": "sha256:88ab5e32bbf5205cac37d9464c219373ac4bbbb169bcfc5035bf5baf56919202",
    "planes": {
      "native": 40,
      "observed": 40,
      "desired": 12,
      "current": 2,
      "pending": 38,
      "hostEffective": 40
    },
    "drift": [
      {
        "entityId": "company:example/security-default",
        "field": "policy.permissions.sandbox",
        "category": "EFFECTIVE_DRIFT",
        "expected": "workspace-write",
        "observed": "danger-full-access",
        "rootCause": "Company baseline is not represented in pending runtimes",
        "remediation": "rebuild 38 artifacts; retain 2 explicit exceptions",
        "contextCell": "infra2 / Codex",
        "evidenceLevel": "E3",
        "guarantee": "RECONCILED"
      }
    ],
    "knowledgeStatus": {
      "codex": "FRESH",
      "claude-code": "DUE"
    }
  }
}
